"Swiss Tropical Institute, Basel, Switzerland","Hatz, Christoph","unibas","10.1086/424469","https://doi.org/10.1086/424469","http://doc.rero.ch/record/302378/files/190-9-1541.pdf","Screening for Mutations Related to Atovaquone/ Proguanil Resistance in Treatment Failures and Other Imported Isolates of Plasmodium falciparum in Europe","","Wichmann, Ole;Muehlberger, Nikolai;Jelinek, Tomas;Alifrangis, Michael;Hoffmann, Gabriele Peyerl;Hlen, Marion Mü;Grobusch, Martin P.;Gascon, Joaquim;Matteelli, Alberto;Laferl, Hermann;Bisoffi, Zeno;Ehrhardt, Stephan;Cuadros, Juan;Hatz, Christoph;Gjorup, Ida;Mcwhinney, Paul;Beran, Jiři;Cunha, Saraiva Da;Schulze, Marco;Kollaritsch, Herwig;Kern, Peter;Fry, Graham;Richter, Joachim","2004","Journal of Infectious Diseases","Institute of Tropical Medicine, Charité, Humboldt University, Charité, Berlin E-mail: ole.wichmann@charite.de;Institute of Tropical Medicine, Charité, Humboldt University, Charité, Berlin;Institute of Tropical Medicine, Charité, Humboldt University, Charité, Berlin Department of Infectious Diseases and Tropical Medicine, University of Munich, Munich;Centre of Medical Parasitology, Panum Institute, Copenhagen, Denmark;Institute of Tropical Medicine, Charité, Humboldt University, Charité, Berlin Department of Infectious Diseases and Tropical Medicine, University of Munich, Munich;Institute of Tropical Medicine, Charité, Humboldt University, Charité, Berlin;Department of Medicine (Infectious Diseases), Charité, Berlin Institut für Tropenmedizin, Eberhard-Karls-Universität Tübingen, Tübingen;Sección de Medicina Tropical, Hospital Clinic, Barcelona;Clinica di Malattie Infettive e Tropicali, Universitá di Brescia, Brescia;Kaiser-Franz-Josef-Spital der Stadt Wien, 4. Medizinische Abteilung mit Infektions und Tropenmedizin, Vienna, Austria;Centro per le Malattie Tropicali, Ospedale S. Cuore, Negrar (Verona), Italy;Clinical Department, Bernhard Nocht Institute for Tropical Medicine, Hamburg;Department of Clinical Microbiology and Parasitology, Hospital Príncipe de Asturias, Madrid, Spain;Swiss Tropical Institute, Basel, Switzerland;Department of Infectious Diseases, University Hospital, University of Copenhagen, Copenhagen, Denmark;Bradford Royal Infirmary, Infection and Tropical Medicine, Bradford, United Kingdom;Department of Infectious Diseases, University Hospital, Hradec Králové, Czech Republic;Consulta de Medicina do Viajante, Departamento de Doenças Infecciosas, Hospital Universitário, Coimbra, Portugal;Städtische Kliniken "St. Georg," 2. Klinik für Innere Medizin, Leipzig;Abteilung für spezifische Prophylaxe und Tropenmedizin am Institut für Pathophysiologie, University of Vienna, Vienna, Austria;Sektion Infektiologie und Klinische Immunologie, Universität Ulm, Ulm;Tropical Medical Bureau, Dublin, Ireland;Klinik für Gastroenterologie, Hepatologie, und Infektiologie, Medizinische Klinik und Poliklinik der Universität, Düsseldorf, Germany","The University of Chicago Press","","190","9","1541","1546","0022-1899","1537-6613","copyright","© 2004 by the Infectious Diseases Society of America","oxford","https://www.swissbib.ch/Search/Results?lookfor=nationallicenceoxford101086424469","http://sru.swissbib.ch/sru/search/defaultdb?query=+dc.anywhere+exact+NATIONALLICENCEoxford101086424469&operation=searchRetrieve&recordSchema=info%3Asrw%2Fschema%2F1%2Fmarcxml-v1.1-light&maximumRecords=10&startRecord=0&recordPacking=XML&availableDBs=defaultdb&sortKeys=Submit+query","http://sru.swissbib.ch/sru/search/defaultdb?query=+dc.anywhere+exact+NATIONALLICENCEoxford101086424469&operation=searchRetrieve&recordSchema=info%3Asrw%2Fschema%2F1%2Fdc-v1.1-light&maximumRecords=10&startRecord=0&recordPacking=XML&availableDBs=defaultdb&sortKeys=Submit+query","http://sru.swissbib.ch/sru/search/defaultdb?query=+dc.anywhere+exact+NATIONALLICENCEoxford101086424469&operation=searchRetrieve&recordSchema=info%3Asru%2Fschema%2Fjson&maximumRecords=10&startRecord=0&recordPacking=XML&availableDBs=defaultdb&sortKeys=Submit+query","It was possible to publish this article open access thanks to a Swiss National Licence with the Publisher","Swiss Tropical Institute, Basel, Switzerland",
"Swiss Tropical Institute, PO Box CH-4002 Basel, Switzerland E-mail: jennifer.keiser@unibas.ch","Keiser, Jennifer","unibas","10.1093/jac/dkl408","https://doi.org/10.1093/jac/dkl408","http://doc.rero.ch/record/301297/files/dkl408.pdf","The synthetic peroxide OZ78 is effective against Echinostoma caproni and Fasciola hepatica","","Keiser, Jennifer;Utzinger, Jürg;Tanner, Marcel;Dong, Yuxiang;Vennerstrom, Jonathan L.","2006","Journal of Antimicrobial Chemotherapy","Swiss Tropical Institute, PO Box CH-4002 Basel, Switzerland E-mail: jennifer.keiser@unibas.ch;Swiss Tropical Institute, PO Box CH-4002 Basel, Switzerland;Swiss Tropical Institute, PO Box CH-4002 Basel, Switzerland;College of Pharmacy, University of Nebraska Medical Center Nebraska, NE 68198-6025, USA;College of Pharmacy, University of Nebraska Medical Center Nebraska, NE 68198-6025, USA","Oxford University Press","","58","6","1193","1197","0305-7453","1460-2091","copyright","© The Author 2006. Published by Oxford University Press on behalf of the British Society for Antimicrobial Chemotherapy. All rights reserved. For Permissions, please e-mail: journals.permissions@oxfordjournals.org","oxford","https://www.swissbib.ch/Search/Results?lookfor=nationallicenceoxford101093jacdkl408","http://sru.swissbib.ch/sru/search/defaultdb?query=+dc.anywhere+exact+NATIONALLICENCEoxford101093jacdkl408&operation=searchRetrieve&recordSchema=info%3Asrw%2Fschema%2F1%2Fmarcxml-v1.1-light&maximumRecords=10&startRecord=0&recordPacking=XML&availableDBs=defaultdb&sortKeys=Submit+query","http://sru.swissbib.ch/sru/search/defaultdb?query=+dc.anywhere+exact+NATIONALLICENCEoxford101093jacdkl408&operation=searchRetrieve&recordSchema=info%3Asrw%2Fschema%2F1%2Fdc-v1.1-light&maximumRecords=10&startRecord=0&recordPacking=XML&availableDBs=defaultdb&sortKeys=Submit+query","http://sru.swissbib.ch/sru/search/defaultdb?query=+dc.anywhere+exact+NATIONALLICENCEoxford101093jacdkl408&operation=searchRetrieve&recordSchema=info%3Asru%2Fschema%2Fjson&maximumRecords=10&startRecord=0&recordPacking=XML&availableDBs=defaultdb&sortKeys=Submit+query","It was possible to publish this article open access thanks to a Swiss National Licence with the Publisher","Swiss Tropical Institute, PO Box CH-4002 Basel, Switzerland E-mail: jennifer.keiser@unibas.ch",
"Swiss Tropical Institute, Department of Public Health and Epidemiology, Socinstrasse 57, 4002 Basel, Switzerland ∗Address for correspondence: Marcel Tanner, Swiss Tropical Institute, Department of Public Health and Epidemiology, Socinstrasse 57, CH-4002 Basel, Switzerland.","Tanner, M.","unibas","10.1016/0035-9203(93)90070-7","https://doi.org/10.1016/0035-9203(93)90070-7","http://doc.rero.ch/record/303156/files/87-5-518.pdf","Case studies from the biomedical and health systems research activities of the Swiss Tropical Institute in Africa","","Tanner, M.;Lengeler, Ch.;Lorenz, N.","1993","Transactions of The Royal Society of Tropical Medicine and Hygiene","Swiss Tropical Institute, Department of Public Health and Epidemiology, Socinstrasse 57, 4002 Basel, Switzerland ∗Address for correspondence: Marcel Tanner, Swiss Tropical Institute, Department of Public Health and Epidemiology, Socinstrasse 57, CH-4002 Basel, Switzerland.;Swiss Tropical Institute, Department of Public Health and Epidemiology, Socinstrasse 57, 4002 Basel, Switzerland Tropical Epidemiology Unit, London School of Hygiene and Tropical Medicine, Keppel Street, London, WC1E 7HT, UK;Swiss Tropical Institute, Department of Public Health and Epidemiology, Socinstrasse 57, 4002 Basel, Switzerland","Royal Society of Tropical Medicine and Hygiene","","87","5","518","523","0035-9203","1878-3503","","","oxford","https://www.swissbib.ch/Search/Results?lookfor=nationallicenceoxford1010160035920393900707","http://sru.swissbib.ch/sru/search/defaultdb?query=+dc.anywhere+exact+NATIONALLICENCEoxford1010160035920393900707&operation=searchRetrieve&recordSchema=info%3Asrw%2Fschema%2F1%2Fmarcxml-v1.1-light&maximumRecords=10&startRecord=0&recordPacking=XML&availableDBs=defaultdb&sortKeys=Submit+query","http://sru.swissbib.ch/sru/search/defaultdb?query=+dc.anywhere+exact+NATIONALLICENCEoxford1010160035920393900707&operation=searchRetrieve&recordSchema=info%3Asrw%2Fschema%2F1%2Fdc-v1.1-light&maximumRecords=10&startRecord=0&recordPacking=XML&availableDBs=defaultdb&sortKeys=Submit+query","http://sru.swissbib.ch/sru/search/defaultdb?query=+dc.anywhere+exact+NATIONALLICENCEoxford1010160035920393900707&operation=searchRetrieve&recordSchema=info%3Asru%2Fschema%2Fjson&maximumRecords=10&startRecord=0&recordPacking=XML&availableDBs=defaultdb&sortKeys=Submit+query","It was possible to publish this article open access thanks to a Swiss National Licence with the Publisher","Swiss Tropical Institute, Department of Public Health and Epidemiology, Socinstrasse 57, 4002 Basel, Switzerland ∗Address for correspondence: Marcel Tanner, Swiss Tropical Institute, Department of Public Health and Epidemiology, Socinstrasse 57, CH-4002 Basel, Switzerland.",
"Swiss Tropical Institute Basel, Switzerland","Lengeler, Christian","unibas","10.1016/S0035-9203(03)90048-4","https://doi.org/10.1016/S0035-9203(03)90048-4","http://doc.rero.ch/record/297631/files/97-1-122a.pdf","Re-treatment of bednets in Tanzania: a reply","","Lengeler, Christian;Abdulla, Salim;Mponda, Haji;Armstrong Schellenberg, Joanna","2003","Transactions of The Royal Society of Tropical Medicine and Hygiene","Swiss Tropical Institute Basel, Switzerland;Ifakara Health Research and Development Centre Ifakara, Tanzania;Ifakara Health Research and Development Centre Ifakara, Tanzania;Swiss Tropical Institute Basel, Switzerland Ifakara Health Research and Development Centre Ifakara, Tanzania London School of Hygiene and Tropical Medicine London WCIE 7HT, UK","Royal Society of Tropical Medicine and Hygiene","","97","1","122","122","0035-9203","1878-3503","","","oxford","https://www.swissbib.ch/Search/Results?lookfor=nationallicenceoxford101016S0035920303900484","http://sru.swissbib.ch/sru/search/defaultdb?query=+dc.anywhere+exact+NATIONALLICENCEoxford101016S0035920303900484&operation=searchRetrieve&recordSchema=info%3Asrw%2Fschema%2F1%2Fmarcxml-v1.1-light&maximumRecords=10&startRecord=0&recordPacking=XML&availableDBs=defaultdb&sortKeys=Submit+query","http://sru.swissbib.ch/sru/search/defaultdb?query=+dc.anywhere+exact+NATIONALLICENCEoxford101016S0035920303900484&operation=searchRetrieve&recordSchema=info%3Asrw%2Fschema%2F1%2Fdc-v1.1-light&maximumRecords=10&startRecord=0&recordPacking=XML&availableDBs=defaultdb&sortKeys=Submit+query","http://sru.swissbib.ch/sru/search/defaultdb?query=+dc.anywhere+exact+NATIONALLICENCEoxford101016S0035920303900484&operation=searchRetrieve&recordSchema=info%3Asru%2Fschema%2Fjson&maximumRecords=10&startRecord=0&recordPacking=XML&availableDBs=defaultdb&sortKeys=Submit+query","It was possible to publish this article open access thanks to a Swiss National Licence with the Publisher","Swiss Tropical Institute Basel, Switzerland",
"Medical Department of the Swiss Tropical Institute. Basle, Switzerland","Kielmann, A.","unibas","10.1016/0035-9203(68)90105-3","https://doi.org/10.1016/0035-9203(68)90105-3","http://doc.rero.ch/record/298802/files/62-3-458b.pdf","Fluorescent antibody technique in malaria","","Kielmann, A.;Weiss, N.","1968","Transactions of The Royal Society of Tropical Medicine and Hygiene","Medical Department of the Swiss Tropical Institute. Basle, Switzerland;Medical Department of the Swiss Tropical Institute. Basle, Switzerland","Royal Society of Tropical Medicine and Hygiene","","62","3","458","458","0035-9203","1878-3503","","","oxford","https://www.swissbib.ch/Search/Results?lookfor=nationallicenceoxford1010160035920368901053","http://sru.swissbib.ch/sru/search/defaultdb?query=+dc.anywhere+exact+NATIONALLICENCEoxford1010160035920368901053&operation=searchRetrieve&recordSchema=info%3Asrw%2Fschema%2F1%2Fmarcxml-v1.1-light&maximumRecords=10&startRecord=0&recordPacking=XML&availableDBs=defaultdb&sortKeys=Submit+query","http://sru.swissbib.ch/sru/search/defaultdb?query=+dc.anywhere+exact+NATIONALLICENCEoxford1010160035920368901053&operation=searchRetrieve&recordSchema=info%3Asrw%2Fschema%2F1%2Fdc-v1.1-light&maximumRecords=10&startRecord=0&recordPacking=XML&availableDBs=defaultdb&sortKeys=Submit+query","http://sru.swissbib.ch/sru/search/defaultdb?query=+dc.anywhere+exact+NATIONALLICENCEoxford1010160035920368901053&operation=searchRetrieve&recordSchema=info%3Asru%2Fschema%2Fjson&maximumRecords=10&startRecord=0&recordPacking=XML&availableDBs=defaultdb&sortKeys=Submit+query","It was possible to publish this article open access thanks to a Swiss National Licence with the Publisher","Medical Department of the Swiss Tropical Institute. Basle, Switzerland",
"Swiss Tropical Institute, Basel, Switzerland.","Smith, Thomas","unibas","10.1093/ije/30.6.1440","https://doi.org/10.1093/ije/30.6.1440","http://doc.rero.ch/record/299238/files/0301440.pdf","Survival and sequelae of meningococcal meningitis in Ghana","","Hodgson, Abraham;Smith, Thomas;Gagneux, Sebastien;Akumah, Isaac;Adjuik, Martin;Pluschke, Gerd;Binka, Fred;Genton, Blaise","2001","International Journal of Epidemiology","Navrongo Health Research Centre, Ghana.;Swiss Tropical Institute, Basel, Switzerland.;Swiss Tropical Institute, Basel, Switzerland.;Navrongo Health Research Centre, Ghana.;Navrongo Health Research Centre, Ghana.;Swiss Tropical Institute, Basel, Switzerland.;Navrongo Health Research Centre, Ghana.;Swiss Tropical Institute, Basel, Switzerland.","Oxford University Press","","30","6","1440","1446","0300-5771","1464-3685","copyright","© International Epidemiological Association 2001","oxford","https://www.swissbib.ch/Search/Results?lookfor=nationallicenceoxford101093ije3061440","http://sru.swissbib.ch/sru/search/defaultdb?query=+dc.anywhere+exact+NATIONALLICENCEoxford101093ije3061440&operation=searchRetrieve&recordSchema=info%3Asrw%2Fschema%2F1%2Fmarcxml-v1.1-light&maximumRecords=10&startRecord=0&recordPacking=XML&availableDBs=defaultdb&sortKeys=Submit+query","http://sru.swissbib.ch/sru/search/defaultdb?query=+dc.anywhere+exact+NATIONALLICENCEoxford101093ije3061440&operation=searchRetrieve&recordSchema=info%3Asrw%2Fschema%2F1%2Fdc-v1.1-light&maximumRecords=10&startRecord=0&recordPacking=XML&availableDBs=defaultdb&sortKeys=Submit+query","http://sru.swissbib.ch/sru/search/defaultdb?query=+dc.anywhere+exact+NATIONALLICENCEoxford101093ije3061440&operation=searchRetrieve&recordSchema=info%3Asru%2Fschema%2Fjson&maximumRecords=10&startRecord=0&recordPacking=XML&availableDBs=defaultdb&sortKeys=Submit+query","It was possible to publish this article open access thanks to a Swiss National Licence with the Publisher","Swiss Tropical Institute, Basel, Switzerland.",
"†Swiss Tropical Institute, Department of Public Health and Epidemiology Socinstrasse 57, CH-4051 Basle, Switzerland.","Degrémont, Antoine","unibas","10.1093/ije/20.3.796","https://doi.org/10.1093/ije/20.3.796","http://doc.rero.ch/record/292300/files/20-3-796.pdf","Community-Based Questionnaires and Health Statistics as Tools for the Cost-Efficient Identification of communities at Risk of Urinary Schistosomiasis","","Lengeler, Christian;Savigny, Donald De;Mshinda, Hassan;Mayombana, Charles;Tayari, Severino;Hatz, Christoph;Degrémont, Antoine;Tanner, Marcel","1991","International Journal of Epidemiology","Swiss Tropical Institute Field Laboratory PO Box 53, Ifakara, Tanzania.;Swiss Tropical Institute Field Laboratory PO Box 53, Ifakara, Tanzania.;Swiss Tropical Institute Field Laboratory PO Box 53, Ifakara, Tanzania.;Swiss Tropical Institute Field Laboratory PO Box 53, Ifakara, Tanzania.;District Health Office PO Box 34, Ifakana, Tanzania.;Swiss Tropical Institute Field Laboratory PO Box 53, Ifakara, Tanzania.;†Swiss Tropical Institute, Department of Public Health and Epidemiology Socinstrasse 57, CH-4051 Basle, Switzerland.;†Swiss Tropical Institute, Department of Public Health and Epidemiology Socinstrasse 57, CH-4051 Basle, Switzerland. Reprint requests to: Dr M Tanner, Swiss Tropical Institute, PO Box 4002, Basel, Switzerland.","Oxford University Press","","20","3","796","807","0300-5771","1464-3685","copyright","© International Epidemiological Association","oxford","https://www.swissbib.ch/Search/Results?lookfor=nationallicenceoxford101093ije203796","http://sru.swissbib.ch/sru/search/defaultdb?query=+dc.anywhere+exact+NATIONALLICENCEoxford101093ije203796&operation=searchRetrieve&recordSchema=info%3Asrw%2Fschema%2F1%2Fmarcxml-v1.1-light&maximumRecords=10&startRecord=0&recordPacking=XML&availableDBs=defaultdb&sortKeys=Submit+query","http://sru.swissbib.ch/sru/search/defaultdb?query=+dc.anywhere+exact+NATIONALLICENCEoxford101093ije203796&operation=searchRetrieve&recordSchema=info%3Asrw%2Fschema%2F1%2Fdc-v1.1-light&maximumRecords=10&startRecord=0&recordPacking=XML&availableDBs=defaultdb&sortKeys=Submit+query","http://sru.swissbib.ch/sru/search/defaultdb?query=+dc.anywhere+exact+NATIONALLICENCEoxford101093ije203796&operation=searchRetrieve&recordSchema=info%3Asru%2Fschema%2Fjson&maximumRecords=10&startRecord=0&recordPacking=XML&availableDBs=defaultdb&sortKeys=Submit+query","It was possible to publish this article open access thanks to a Swiss National Licence with the Publisher","Swiss Tropical Institute Field Laboratory PO Box 53, Ifakara, Tanzania.",
"Swiss Tropical Institute, Basel, Switzerland.","Stirnadel, Ha","unibas","10.1093/ije/29.3.579","https://doi.org/10.1093/ije/29.3.579","http://doc.rero.ch/record/296401/files/0290579.pdf","Assessment of different sources of variation in the antibody responses to specific malaria antigens in children in Papua New Guinea","","Stirnadel, Ha;Al-Yaman, F;Genton, B;Alpers, Mp;Smith, Ta","2000","International Journal of Epidemiology","Swiss Tropical Institute, Basel, Switzerland.;Papua New Guinea Institute of Medical Research, Goroka, Papua New Guinea.;Swiss Tropical Institute, Basel, Switzerland. Papua New Guinea Institute of Medical Research, Goroka, Papua New Guinea.;Papua New Guinea Institute of Medical Research, Goroka, Papua New Guinea.;Swiss Tropical Institute, Basel, Switzerland. Papua New Guinea Institute of Medical Research, Goroka, Papua New Guinea.","Oxford University Press","","29","3","579","586","0300-5771","1464-3685","copyright","© International Epidemiological Association 2000","oxford","https://www.swissbib.ch/Search/Results?lookfor=nationallicenceoxford101093ije293579","http://sru.swissbib.ch/sru/search/defaultdb?query=+dc.anywhere+exact+NATIONALLICENCEoxford101093ije293579&operation=searchRetrieve&recordSchema=info%3Asrw%2Fschema%2F1%2Fmarcxml-v1.1-light&maximumRecords=10&startRecord=0&recordPacking=XML&availableDBs=defaultdb&sortKeys=Submit+query","http://sru.swissbib.ch/sru/search/defaultdb?query=+dc.anywhere+exact+NATIONALLICENCEoxford101093ije293579&operation=searchRetrieve&recordSchema=info%3Asrw%2Fschema%2F1%2Fdc-v1.1-light&maximumRecords=10&startRecord=0&recordPacking=XML&availableDBs=defaultdb&sortKeys=Submit+query","http://sru.swissbib.ch/sru/search/defaultdb?query=+dc.anywhere+exact+NATIONALLICENCEoxford101093ije293579&operation=searchRetrieve&recordSchema=info%3Asru%2Fschema%2Fjson&maximumRecords=10&startRecord=0&recordPacking=XML&availableDBs=defaultdb&sortKeys=Submit+query","It was possible to publish this article open access thanks to a Swiss National Licence with the Publisher","Swiss Tropical Institute, Basel, Switzerland.",
"Department of Entomology, University of Kentucky, S-225 Agricultural Science Center North, Lexington, KY 40546-0091. 2Current address: Department of Epidemiology and Public Health, Swiss Tropical and Public Health Institute, P.O. Box, CH-4002 Basel, Switzerland.","Stone, C. M.","unibas","10.1603/ME13023","https://doi.org/10.1603/ME13023","http://doc.rero.ch/record/301342/files/jmedent50-0723.pdf","Determinants of Male Aedes aegypti and Aedes polynesiensis (Diptera: Culicidae) Response to Sound: Efficacy and Considerations for Use of Sound Traps in the Field","","Stone, C. M.;Tuten, H. C.;Dobson, S. L.","2013","Journal of Medical Entomology","Department of Entomology, University of Kentucky, S-225 Agricultural Science Center North, Lexington, KY 40546-0091. 2Current address: Department of Epidemiology and Public Health, Swiss Tropical and Public Health Institute, P.O. Box, CH-4002 Basel, Switzerland.;Department of Entomology, University of Kentucky, S-225 Agricultural Science Center North, Lexington, KY 40546-0091. 3Current address: Institute of Parasitology, Vector Entomology Unit, University of Zürich, Winterthurerstrasse 266a, CH-8057 Zürich, Switzerland.;Department of Entomology, University of Kentucky, S-225 Agricultural Science Center North, Lexington, KY 40546-0091. E-mail: sdobson@uky.edu","Oxford University Press","","50","4","723","730","0022-2585","1938-2928","copyright","© 2013 Entomological Society of America","oxford","https://www.swissbib.ch/Search/Results?lookfor=nationallicenceoxford101603ME13023","http://sru.swissbib.ch/sru/search/defaultdb?query=+dc.anywhere+exact+NATIONALLICENCEoxford101603ME13023&operation=searchRetrieve&recordSchema=info%3Asrw%2Fschema%2F1%2Fmarcxml-v1.1-light&maximumRecords=10&startRecord=0&recordPacking=XML&availableDBs=defaultdb&sortKeys=Submit+query","http://sru.swissbib.ch/sru/search/defaultdb?query=+dc.anywhere+exact+NATIONALLICENCEoxford101603ME13023&operation=searchRetrieve&recordSchema=info%3Asrw%2Fschema%2F1%2Fdc-v1.1-light&maximumRecords=10&startRecord=0&recordPacking=XML&availableDBs=defaultdb&sortKeys=Submit+query","http://sru.swissbib.ch/sru/search/defaultdb?query=+dc.anywhere+exact+NATIONALLICENCEoxford101603ME13023&operation=searchRetrieve&recordSchema=info%3Asru%2Fschema%2Fjson&maximumRecords=10&startRecord=0&recordPacking=XML&availableDBs=defaultdb&sortKeys=Submit+query","It was possible to publish this article open access thanks to a Swiss National Licence with the Publisher","Department of Entomology, University of Kentucky, S-225 Agricultural Science Center North, Lexington, KY 40546-0091. 2Current address: Department of Epidemiology and Public Health, Swiss Tropical and Public Health Institute, P.O. Box, CH-4002 Basel, Switzerland.",
"Swiss Tropical Institute, Basel, Switzerland","Hatz, Christoph H.","unibas","10.1086/511687","https://doi.org/10.1086/511687","http://doc.rero.ch/record/293194/files/44-5-761.pdf","Illness in Travelers Visiting Friends and Relatives: What Can Be Concluded?","","Behrens, Ron H.;Hatz, Christoph H.;Gushulak, Brian D.;Macpherson, Douglas W.","2007","Clinical Infectious Diseases","Hospital for Tropical Diseases, London School of Hygiene and Tropical Medicine, United Kingdom E-mail: Ron.Behrens@lshtm.ac.uk;Swiss Tropical Institute, Basel, Switzerland;Migration Health Consultants, Vienna, Austria;Migration Health Consultants, McMaster University, Hamilton, Ontario, Canada","The University of Chicago Press","","44","5","761","762","1058-4838","1537-6591","copyright","© 2007 by the Infectious Diseases Society of America","oxford","https://www.swissbib.ch/Search/Results?lookfor=nationallicenceoxford101086511687","http://sru.swissbib.ch/sru/search/defaultdb?query=+dc.anywhere+exact+NATIONALLICENCEoxford101086511687&operation=searchRetrieve&recordSchema=info%3Asrw%2Fschema%2F1%2Fmarcxml-v1.1-light&maximumRecords=10&startRecord=0&recordPacking=XML&availableDBs=defaultdb&sortKeys=Submit+query","http://sru.swissbib.ch/sru/search/defaultdb?query=+dc.anywhere+exact+NATIONALLICENCEoxford101086511687&operation=searchRetrieve&recordSchema=info%3Asrw%2Fschema%2F1%2Fdc-v1.1-light&maximumRecords=10&startRecord=0&recordPacking=XML&availableDBs=defaultdb&sortKeys=Submit+query","http://sru.swissbib.ch/sru/search/defaultdb?query=+dc.anywhere+exact+NATIONALLICENCEoxford101086511687&operation=searchRetrieve&recordSchema=info%3Asru%2Fschema%2Fjson&maximumRecords=10&startRecord=0&recordPacking=XML&availableDBs=defaultdb&sortKeys=Submit+query","It was possible to publish this article open access thanks to a Swiss National Licence with the Publisher","Swiss Tropical Institute, Basel, Switzerland",
