"Swiss Tropical Institute, Socinstrasse 57, 4002 Basel, Switzerland","Felger, I.","unibas","10.1016/S0035-9203(99)90327-9","https://doi.org/10.1016/S0035-9203(99)90327-9","http://doc.rero.ch/record/295194/files/93-Supplement_1-47.pdf","9. Effect of insecticide-treated bed nets on haemoglobin values, prevalence and multiplicity of infection with Plasmodium falciparum in a randomized controlled trial in Tanzania","","Fraser-Hurt, N.;Felger, I.;Edoh, D.;Steiger, S.;Mashaka, M.;Masanja, H.;Smith, T.;Mbena, F.;Beck, H.-P.","1999","Transactions of The Royal Society of Tropical Medicine and Hygiene","Ifakara Health Research and Development Centre, P.O. Box 53, Ifakara, Tanzania;Swiss Tropical Institute, Socinstrasse 57, 4002 Basel, Switzerland;Ifakara Health Research and Development Centre, P.O. Box 53, Ifakara, Tanzania;Swiss Tropical Institute, Socinstrasse 57, 4002 Basel, Switzerland;Ifakara Health Research and Development Centre, P.O. Box 53, Ifakara, Tanzania;Ifakara Health Research and Development Centre, P.O. Box 53, Ifakara, Tanzania;Ifakara Health Research and Development Centre, P.O. Box 53, Ifakara, Tanzania;Swiss Tropical Institute, Socinstrasse 57, 4002 Basel, Switzerland;Ifakara Health Research and Development Centre, P.O. Box 53, Ifakara, Tanzania E-mail: beckhp@ubaclu.unibas.ch","Royal Society of Tropical Medicine and Hygiene","","93","Supplement_1","47","51","0035-9203","1878-3503","","","oxford","https://www.swissbib.ch/Search/Results?lookfor=nationallicenceoxford101016S0035920399903279","http://sru.swissbib.ch/sru/search/defaultdb?query=+dc.anywhere+exact+NATIONALLICENCEoxford101016S0035920399903279&operation=searchRetrieve&recordSchema=info%3Asrw%2Fschema%2F1%2Fmarcxml-v1.1-light&maximumRecords=10&startRecord=0&recordPacking=XML&availableDBs=defaultdb&sortKeys=Submit+query","http://sru.swissbib.ch/sru/search/defaultdb?query=+dc.anywhere+exact+NATIONALLICENCEoxford101016S0035920399903279&operation=searchRetrieve&recordSchema=info%3Asrw%2Fschema%2F1%2Fdc-v1.1-light&maximumRecords=10&startRecord=0&recordPacking=XML&availableDBs=defaultdb&sortKeys=Submit+query","http://sru.swissbib.ch/sru/search/defaultdb?query=+dc.anywhere+exact+NATIONALLICENCEoxford101016S0035920399903279&operation=searchRetrieve&recordSchema=info%3Asru%2Fschema%2Fjson&maximumRecords=10&startRecord=0&recordPacking=XML&availableDBs=defaultdb&sortKeys=Submit+query","It was possible to publish this article open access thanks to a Swiss National Licence with the Publisher","Swiss Tropical Institute, Socinstrasse 57, 4002 Basel, Switzerland",
"Department of Public Health and Epidemiology, Swiss Tropical Institute, Socinstrasse 57, Postfach CH-4002, Basel, Switzerland E-mail: wilson.sama@unibas.ch","Sama, W.","unibas","10.1016/j.trstmh.2005.11.001","https://doi.org/10.1016/j.trstmh.2005.11.001","http://doc.rero.ch/record/296983/files/100-9-811.pdf","Distribution of survival times of deliberate Plasmodium falciparum infections in tertiary syphilis patients","","Sama, W.;Dietz, K.;Smith, T.","2006","Transactions of The Royal Society of Tropical Medicine and Hygiene","Department of Public Health and Epidemiology, Swiss Tropical Institute, Socinstrasse 57, Postfach CH-4002, Basel, Switzerland E-mail: wilson.sama@unibas.ch;Institut für Medizinische Biometrie, Westbahnhofstrasse 55, D-72070 Tübingen, Germany;Department of Public Health and Epidemiology, Swiss Tropical Institute, Socinstrasse 57, Postfach CH-4002, Basel, Switzerland","Royal Society of Tropical Medicine and Hygiene","","100","9","811","816","0035-9203","1878-3503","","","oxford","https://www.swissbib.ch/Search/Results?lookfor=nationallicenceoxford101016jtrstmh200511001","http://sru.swissbib.ch/sru/search/defaultdb?query=+dc.anywhere+exact+NATIONALLICENCEoxford101016jtrstmh200511001&operation=searchRetrieve&recordSchema=info%3Asrw%2Fschema%2F1%2Fmarcxml-v1.1-light&maximumRecords=10&startRecord=0&recordPacking=XML&availableDBs=defaultdb&sortKeys=Submit+query","http://sru.swissbib.ch/sru/search/defaultdb?query=+dc.anywhere+exact+NATIONALLICENCEoxford101016jtrstmh200511001&operation=searchRetrieve&recordSchema=info%3Asrw%2Fschema%2F1%2Fdc-v1.1-light&maximumRecords=10&startRecord=0&recordPacking=XML&availableDBs=defaultdb&sortKeys=Submit+query","http://sru.swissbib.ch/sru/search/defaultdb?query=+dc.anywhere+exact+NATIONALLICENCEoxford101016jtrstmh200511001&operation=searchRetrieve&recordSchema=info%3Asru%2Fschema%2Fjson&maximumRecords=10&startRecord=0&recordPacking=XML&availableDBs=defaultdb&sortKeys=Submit+query","It was possible to publish this article open access thanks to a Swiss National Licence with the Publisher","Department of Public Health and Epidemiology, Swiss Tropical Institute, Socinstrasse 57, Postfach CH-4002, Basel, Switzerland E-mail: wilson.sama@unibas.ch",
"Swiss Tropical Institute Socinstrasse 57 P.O. Box CH-4002 Basel, Switzerland","Smith, Tom","unibas","10.1016/S0035-9203(01)90221-4","https://doi.org/10.1016/S0035-9203(01)90221-4","http://doc.rero.ch/record/300983/files/95-3-238.pdf","An Introduction to Randomized Controlled Clinical Trials. J. N. S. Matthews. London: Arnold, 2000. xiv+189pp. Price £9.99 (paperback). ISBN 0-340-76143-1","","Smith, Tom","2001","Transactions of The Royal Society of Tropical Medicine and Hygiene","Swiss Tropical Institute Socinstrasse 57 P.O. Box CH-4002 Basel, Switzerland","Royal Society of Tropical Medicine and Hygiene","","95","3","238","238","0035-9203","1878-3503","","","oxford","https://www.swissbib.ch/Search/Results?lookfor=nationallicenceoxford101016S0035920301902214","http://sru.swissbib.ch/sru/search/defaultdb?query=+dc.anywhere+exact+NATIONALLICENCEoxford101016S0035920301902214&operation=searchRetrieve&recordSchema=info%3Asrw%2Fschema%2F1%2Fmarcxml-v1.1-light&maximumRecords=10&startRecord=0&recordPacking=XML&availableDBs=defaultdb&sortKeys=Submit+query","http://sru.swissbib.ch/sru/search/defaultdb?query=+dc.anywhere+exact+NATIONALLICENCEoxford101016S0035920301902214&operation=searchRetrieve&recordSchema=info%3Asrw%2Fschema%2F1%2Fdc-v1.1-light&maximumRecords=10&startRecord=0&recordPacking=XML&availableDBs=defaultdb&sortKeys=Submit+query","http://sru.swissbib.ch/sru/search/defaultdb?query=+dc.anywhere+exact+NATIONALLICENCEoxford101016S0035920301902214&operation=searchRetrieve&recordSchema=info%3Asru%2Fschema%2Fjson&maximumRecords=10&startRecord=0&recordPacking=XML&availableDBs=defaultdb&sortKeys=Submit+query","It was possible to publish this article open access thanks to a Swiss National Licence with the Publisher","Swiss Tropical Institute Socinstrasse 57 P.O. Box CH-4002 Basel, Switzerland",
"Ifakara Centre, P.O. Box 53, Ifakara, Tanzania Address for correspondence: Nicole Hurt, Department of Public Health and Epidemiology, Swiss Tropical Institute, P.O. Box, CH-4002 Basel, Switzerland.","Hurt, N.","unibas","10.1016/0035-9203(94)90287-9","https://doi.org/10.1016/0035-9203(94)90287-9","http://doc.rero.ch/record/298199/files/88-2-182.pdf","Evaluation of C-reactive protein and haptoglobin as malaria episode markers in an area of high transmission in Africa","","Hurt, N.;Smith, T.;Tanner, M.;Mwankusye, S.;Bordmann, G.;Weiss, N.A.;Teuscher, T.","1994","Transactions of The Royal Society of Tropical Medicine and Hygiene","Ifakara Centre, P.O. Box 53, Ifakara, Tanzania Address for correspondence: Nicole Hurt, Department of Public Health and Epidemiology, Swiss Tropical Institute, P.O. Box, CH-4002 Basel, Switzerland.;Ifakara Centre, P.O. Box 53, Ifakara, Tanzania Swiss Tropical Institute, P.O. Box, 4002 Basel, Switzerland;Ifakara Centre, P.O. Box 53, Ifakara, Tanzania Swiss Tropical Institute, P.O. Box, 4002 Basel, Switzerland;Ifakara Centre, P.O. Box 53, Ifakara, Tanzania;Swiss Tropical Institute, P.O. Box, 4002 Basel, Switzerland;Swiss Tropical Institute, P.O. Box, 4002 Basel, Switzerland;Ifakara Centre, P.O. Box 53, Ifakara, Tanzania","Royal Society of Tropical Medicine and Hygiene","","88","2","182","186","0035-9203","1878-3503","","","oxford","https://www.swissbib.ch/Search/Results?lookfor=nationallicenceoxford1010160035920394902879","http://sru.swissbib.ch/sru/search/defaultdb?query=+dc.anywhere+exact+NATIONALLICENCEoxford1010160035920394902879&operation=searchRetrieve&recordSchema=info%3Asrw%2Fschema%2F1%2Fmarcxml-v1.1-light&maximumRecords=10&startRecord=0&recordPacking=XML&availableDBs=defaultdb&sortKeys=Submit+query","http://sru.swissbib.ch/sru/search/defaultdb?query=+dc.anywhere+exact+NATIONALLICENCEoxford1010160035920394902879&operation=searchRetrieve&recordSchema=info%3Asrw%2Fschema%2F1%2Fdc-v1.1-light&maximumRecords=10&startRecord=0&recordPacking=XML&availableDBs=defaultdb&sortKeys=Submit+query","http://sru.swissbib.ch/sru/search/defaultdb?query=+dc.anywhere+exact+NATIONALLICENCEoxford1010160035920394902879&operation=searchRetrieve&recordSchema=info%3Asru%2Fschema%2Fjson&maximumRecords=10&startRecord=0&recordPacking=XML&availableDBs=defaultdb&sortKeys=Submit+query","It was possible to publish this article open access thanks to a Swiss National Licence with the Publisher","Ifakara Centre, P.O. Box 53, Ifakara, Tanzania Address for correspondence: Nicole Hurt, Department of Public Health and Epidemiology, Swiss Tropical Institute, P.O. Box, CH-4002 Basel, Switzerland.",
"Swiss Tropical and Public Health Institute, Basel 4002, Switzerland","Tanner, Marcel","unibas","10.1093/trstmh/trt086","https://doi.org/10.1093/trstmh/trt086","http://doc.rero.ch/record/295130/files/trt086.pdf","Malaria and soil-transmitted intestinal helminth co-infection and its effect on anemia: a meta-analysis","","Naing, Cho;Whittaker, Maxine A;Nyunt-Wai, Victor;Reid, Simon A;Wong, Shew Fung;Mak, Joon Wah;Tanner, Marcel","2013","Transactions of The Royal Society of Tropical Medicine and Hygiene","School of Population Health, University of Queensland, Queensland 4006, Australia International Medical University, Kuala Lumpur 57000, Malaysia;School of Population Health, University of Queensland, Queensland 4006, Australia;International Medical University, Kuala Lumpur 57000, Malaysia;School of Population Health, University of Queensland, Queensland 4006, Australia;International Medical University, Kuala Lumpur 57000, Malaysia;International Medical University, Kuala Lumpur 57000, Malaysia;Swiss Tropical and Public Health Institute, Basel 4002, Switzerland","Oxford University Press","","107","11","672","683","0035-9203","1878-3503","copyright","© The Author 2013. Published by Oxford University Press on behalf of Royal Society of Tropical Medicine and Hygiene. All rights reserved. For permissions, please e-mail: journals.permissions@oup.com.","oxford","https://www.swissbib.ch/Search/Results?lookfor=nationallicenceoxford101093trstmhtrt086","http://sru.swissbib.ch/sru/search/defaultdb?query=+dc.anywhere+exact+NATIONALLICENCEoxford101093trstmhtrt086&operation=searchRetrieve&recordSchema=info%3Asrw%2Fschema%2F1%2Fmarcxml-v1.1-light&maximumRecords=10&startRecord=0&recordPacking=XML&availableDBs=defaultdb&sortKeys=Submit+query","http://sru.swissbib.ch/sru/search/defaultdb?query=+dc.anywhere+exact+NATIONALLICENCEoxford101093trstmhtrt086&operation=searchRetrieve&recordSchema=info%3Asrw%2Fschema%2F1%2Fdc-v1.1-light&maximumRecords=10&startRecord=0&recordPacking=XML&availableDBs=defaultdb&sortKeys=Submit+query","http://sru.swissbib.ch/sru/search/defaultdb?query=+dc.anywhere+exact+NATIONALLICENCEoxford101093trstmhtrt086&operation=searchRetrieve&recordSchema=info%3Asru%2Fschema%2Fjson&maximumRecords=10&startRecord=0&recordPacking=XML&availableDBs=defaultdb&sortKeys=Submit+query","It was possible to publish this article open access thanks to a Swiss National Licence with the Publisher","Swiss Tropical and Public Health Institute, Basel 4002, Switzerland",
"Swiss Tropical Institute, Basel, Switzerland","Brun, Reto","unibas","10.1086/430928","https://doi.org/10.1086/430928","http://doc.rero.ch/record/304832/files/192-2-319.pdf","Efficacy of DB289 in Thai Patients with Plasmodium vivax or Acute, Uncomplicated Plasmodium falciparum Infections","","Yeramian, Patrick;Meshnick, Steven R.;Krudsood, Srivicha;Chalermrut, Kobsiri;Silachamroon, Udomsak;Tangpukdee, Noppadon;Allen, James;Brun, Reto;Kwiek, Jesse J.;Tidwell, Richard;Looareesuwan, Sornchai","2005","The Journal of Infectious Diseases","Immtech International, Vernon Hills, Illinois;;Department of Epidemiology, School of Public Health, and;Faculty of Tropical Medicine, Mahidol University, Bangkok, Thailand;;Faculty of Tropical Medicine, Mahidol University, Bangkok, Thailand;;Faculty of Tropical Medicine, Mahidol University, Bangkok, Thailand;;Faculty of Tropical Medicine, Mahidol University, Bangkok, Thailand;;Immtech International, Vernon Hills, Illinois;;Swiss Tropical Institute, Basel, Switzerland;Department of Epidemiology, School of Public Health, and;Department of Pathology, School of Medicine, University of North Carolina, Chapel Hill;;Faculty of Tropical Medicine, Mahidol University, Bangkok, Thailand;","The University of Chicago Press","","192","2","319","322","0022-1899","1537-6613","copyright","© 2005 by the Infectious Diseases Society of America","oxford","https://www.swissbib.ch/Search/Results?lookfor=nationallicenceoxford101086430928","http://sru.swissbib.ch/sru/search/defaultdb?query=+dc.anywhere+exact+NATIONALLICENCEoxford101086430928&operation=searchRetrieve&recordSchema=info%3Asrw%2Fschema%2F1%2Fmarcxml-v1.1-light&maximumRecords=10&startRecord=0&recordPacking=XML&availableDBs=defaultdb&sortKeys=Submit+query","http://sru.swissbib.ch/sru/search/defaultdb?query=+dc.anywhere+exact+NATIONALLICENCEoxford101086430928&operation=searchRetrieve&recordSchema=info%3Asrw%2Fschema%2F1%2Fdc-v1.1-light&maximumRecords=10&startRecord=0&recordPacking=XML&availableDBs=defaultdb&sortKeys=Submit+query","http://sru.swissbib.ch/sru/search/defaultdb?query=+dc.anywhere+exact+NATIONALLICENCEoxford101086430928&operation=searchRetrieve&recordSchema=info%3Asru%2Fschema%2Fjson&maximumRecords=10&startRecord=0&recordPacking=XML&availableDBs=defaultdb&sortKeys=Submit+query","It was possible to publish this article open access thanks to a Swiss National Licence with the Publisher","Swiss Tropical Institute, Basel, Switzerland",
"Swiss Tropical Institute and University Hospital, Basle, Switzerland Firestone Medical Centre, Harbel, Liberia","Stahel, E.","unibas","10.1016/0035-9203(81)90083-3","https://doi.org/10.1016/0035-9203(81)90083-3","http://doc.rero.ch/record/290848/files/75-1-189.pdf","Gastroduodenitis and peptic ulcer in a rural Liberian community—an endoscopic prospective study","","Stahel, E.;Gyr, K.;Heitz, P.","1981","Transactions of The Royal Society of Tropical Medicine and Hygiene","Swiss Tropical Institute and University Hospital, Basle, Switzerland Firestone Medical Centre, Harbel, Liberia;Swiss Tropical Institute and University Hospital, Basle, Switzerland Firestone Medical Centre, Harbel, Liberia;Swiss Tropical Institute and University Hospital, Basle, Switzerland Firestone Medical Centre, Harbel, Liberia","Royal Society of Tropical Medicine and Hygiene","","75","1","189","189","0035-9203","1878-3503","","","oxford","https://www.swissbib.ch/Search/Results?lookfor=nationallicenceoxford1010160035920381900833","http://sru.swissbib.ch/sru/search/defaultdb?query=+dc.anywhere+exact+NATIONALLICENCEoxford1010160035920381900833&operation=searchRetrieve&recordSchema=info%3Asrw%2Fschema%2F1%2Fmarcxml-v1.1-light&maximumRecords=10&startRecord=0&recordPacking=XML&availableDBs=defaultdb&sortKeys=Submit+query","http://sru.swissbib.ch/sru/search/defaultdb?query=+dc.anywhere+exact+NATIONALLICENCEoxford1010160035920381900833&operation=searchRetrieve&recordSchema=info%3Asrw%2Fschema%2F1%2Fdc-v1.1-light&maximumRecords=10&startRecord=0&recordPacking=XML&availableDBs=defaultdb&sortKeys=Submit+query","http://sru.swissbib.ch/sru/search/defaultdb?query=+dc.anywhere+exact+NATIONALLICENCEoxford1010160035920381900833&operation=searchRetrieve&recordSchema=info%3Asru%2Fschema%2Fjson&maximumRecords=10&startRecord=0&recordPacking=XML&availableDBs=defaultdb&sortKeys=Submit+query","It was possible to publish this article open access thanks to a Swiss National Licence with the Publisher","Swiss Tropical Institute and University Hospital, Basle, Switzerland Firestone Medical Centre, Harbel, Liberia",
"Swiss Tropical Institute,Socinstrasse 57, Postfach CH 4002, Basle, Switzerland","Tanner, M.","unibas","10.1016/S0035-9203(03)80096-2","https://doi.org/10.1016/S0035-9203(03)80096-2","http://doc.rero.ch/record/301657/files/97-6-647.pdf","The incidence of clinical malaria detected by active case detection in children in Ifakara, southern Tanzania","","Schellenberg, D.M.;Aponte, J.J.;Kahigwa, E.A.;Mshinda, H.;Tanner, M.;Menendez, C.;Alonso, P.L.","2003","Transactions of The Royal Society of Tropical Medicine and Hygiene","Centro de Salud International, Institut d'Investigacions Biomedicas August Pi i Sunyer (IDIBAPS), Hospital Clinic, Villarroel 170, 08036 Barcelona, Spain Ifakara Health Research and Development Centre, P. O. Box 53, Ifakara, Tanzania E-mail: dmschellenberg@aol.com;Centro de Salud International, Institut d'Investigacions Biomedicas August Pi i Sunyer (IDIBAPS), Hospital Clinic, Villarroel 170, 08036 Barcelona, Spain;Ifakara Health Research and Development Centre, P. O. Box 53, Ifakara, Tanzania St Francis Designated District Hospital, Ministry of Health, Dar es Salaam, Tanzania;Ifakara Health Research and Development Centre, P. O. Box 53, Ifakara, Tanzania;Swiss Tropical Institute,Socinstrasse 57, Postfach CH 4002, Basle, Switzerland;Centro de Salud International, Institut d'Investigacions Biomedicas August Pi i Sunyer (IDIBAPS), Hospital Clinic, Villarroel 170, 08036 Barcelona, Spain;Centro de Salud International, Institut d'Investigacions Biomedicas August Pi i Sunyer (IDIBAPS), Hospital Clinic, Villarroel 170, 08036 Barcelona, Spain","Royal Society of Tropical Medicine and Hygiene","","97","6","647","654","0035-9203","1878-3503","","","oxford","https://www.swissbib.ch/Search/Results?lookfor=nationallicenceoxford101016S0035920303800962","http://sru.swissbib.ch/sru/search/defaultdb?query=+dc.anywhere+exact+NATIONALLICENCEoxford101016S0035920303800962&operation=searchRetrieve&recordSchema=info%3Asrw%2Fschema%2F1%2Fmarcxml-v1.1-light&maximumRecords=10&startRecord=0&recordPacking=XML&availableDBs=defaultdb&sortKeys=Submit+query","http://sru.swissbib.ch/sru/search/defaultdb?query=+dc.anywhere+exact+NATIONALLICENCEoxford101016S0035920303800962&operation=searchRetrieve&recordSchema=info%3Asrw%2Fschema%2F1%2Fdc-v1.1-light&maximumRecords=10&startRecord=0&recordPacking=XML&availableDBs=defaultdb&sortKeys=Submit+query","http://sru.swissbib.ch/sru/search/defaultdb?query=+dc.anywhere+exact+NATIONALLICENCEoxford101016S0035920303800962&operation=searchRetrieve&recordSchema=info%3Asru%2Fschema%2Fjson&maximumRecords=10&startRecord=0&recordPacking=XML&availableDBs=defaultdb&sortKeys=Submit+query","It was possible to publish this article open access thanks to a Swiss National Licence with the Publisher","Swiss Tropical Institute,Socinstrasse 57, Postfach CH 4002, Basle, Switzerland",
"Centre de Recherche en Santé de Nouna, Nouna, Burkina Faso Swiss Tropical and Public Health Institute (Swiss TPH), 4051 Basel, Switzerland","Diboulo, Eric","unibas","10.1093/trstmh/tru124","https://doi.org/10.1093/trstmh/tru124","http://doc.rero.ch/record/300262/files/tru124.pdf","Childhood mortality and its association with household wealth in rural and semi-urban Burkina Faso","","Schoeps, Anja;Souares, Aurélia;Niamba, Louis;Diboulo, Eric;Kynast-Wolf, Gisela;Müller, Olaf;Sié, Ali;Becher, Heiko","2014","Transactions of The Royal Society of Tropical Medicine and Hygiene","Institute of Public Health, University of Heidelberg, 69120 Heidelberg, Germany;Institute of Public Health, University of Heidelberg, 69120 Heidelberg, Germany;Centre de Recherche en Santé de Nouna, Nouna, Burkina Faso Département de Démographie, Université de Montréal, H3T 1N8 Montréal, Canada;Centre de Recherche en Santé de Nouna, Nouna, Burkina Faso Swiss Tropical and Public Health Institute (Swiss TPH), 4051 Basel, Switzerland;Institute of Public Health, University of Heidelberg, 69120 Heidelberg, Germany;Institute of Public Health, University of Heidelberg, 69120 Heidelberg, Germany;Centre de Recherche en Santé de Nouna, Nouna, Burkina Faso;Institute of Public Health, University of Heidelberg, 69120 Heidelberg, Germany","Oxford University Press","","","","","","0035-9203","1878-3503","copyright","© The Author 2014. Published by Oxford University Press on behalf of Royal Society of Tropical Medicine and Hygiene. All rights reserved. For permissions, please e-mail: journals.permissions@oup.com.","oxford","https://www.swissbib.ch/Search/Results?lookfor=nationallicenceoxford101093trstmhtru124","http://sru.swissbib.ch/sru/search/defaultdb?query=+dc.anywhere+exact+NATIONALLICENCEoxford101093trstmhtru124&operation=searchRetrieve&recordSchema=info%3Asrw%2Fschema%2F1%2Fmarcxml-v1.1-light&maximumRecords=10&startRecord=0&recordPacking=XML&availableDBs=defaultdb&sortKeys=Submit+query","http://sru.swissbib.ch/sru/search/defaultdb?query=+dc.anywhere+exact+NATIONALLICENCEoxford101093trstmhtru124&operation=searchRetrieve&recordSchema=info%3Asrw%2Fschema%2F1%2Fdc-v1.1-light&maximumRecords=10&startRecord=0&recordPacking=XML&availableDBs=defaultdb&sortKeys=Submit+query","http://sru.swissbib.ch/sru/search/defaultdb?query=+dc.anywhere+exact+NATIONALLICENCEoxford101093trstmhtru124&operation=searchRetrieve&recordSchema=info%3Asru%2Fschema%2Fjson&maximumRecords=10&startRecord=0&recordPacking=XML&availableDBs=defaultdb&sortKeys=Submit+query","It was possible to publish this article open access thanks to a Swiss National Licence with the Publisher","Centre de Recherche en Santé de Nouna, Nouna, Burkina Faso Swiss Tropical and Public Health Institute (Swiss TPH), 4051 Basel, Switzerland",
"Swiss Tropical Institute, Socinstrasse 57, 4002, Basel, Switzerland E-mail: beckhp@ubaclu.unibas.ch","Beck, H.-P.","unibas","10.1016/S0035-9203(99)90326-7","https://doi.org/10.1016/S0035-9203(99)90326-7","http://doc.rero.ch/record/302886/files/93-Supplement_1-41.pdf","8. Effect of iron supplementation and malaria prophylaxis in infants on Plasmodium falciparum genotypes and multiplicity of infection","","Beck, H.-P.;Felger, I.;Vounatsou, P.;Hirt, R.;Tanner, M.;Alonso, P.;Menendez, C.","1999","Transactions of The Royal Society of Tropical Medicine and Hygiene","Swiss Tropical Institute, Socinstrasse 57, 4002, Basel, Switzerland E-mail: beckhp@ubaclu.unibas.ch;Swiss Tropical Institute, Socinstrasse 57, 4002, Basel, Switzerland;Swiss Tropical Institute, Socinstrasse 57, 4002, Basel, Switzerland;Ifakara Health Research and Development Centre, Ifakara, Tanzania Unidad de Epidemiologia y Biostadistica, Hospital Clinic, Barcelona, Spain;Swiss Tropical Institute, Socinstrasse 57, 4002, Basel, Switzerland;Unidad de Epidemiologia y Biostadistica, Hospital Clinic, Barcelona, Spain;Unidad de Epidemiologia y Biostadistica, Hospital Clinic, Barcelona, Spain","Royal Society of Tropical Medicine and Hygiene","","93","Supplement_1","41","45","0035-9203","1878-3503","","","oxford","https://www.swissbib.ch/Search/Results?lookfor=nationallicenceoxford101016S0035920399903267","http://sru.swissbib.ch/sru/search/defaultdb?query=+dc.anywhere+exact+NATIONALLICENCEoxford101016S0035920399903267&operation=searchRetrieve&recordSchema=info%3Asrw%2Fschema%2F1%2Fmarcxml-v1.1-light&maximumRecords=10&startRecord=0&recordPacking=XML&availableDBs=defaultdb&sortKeys=Submit+query","http://sru.swissbib.ch/sru/search/defaultdb?query=+dc.anywhere+exact+NATIONALLICENCEoxford101016S0035920399903267&operation=searchRetrieve&recordSchema=info%3Asrw%2Fschema%2F1%2Fdc-v1.1-light&maximumRecords=10&startRecord=0&recordPacking=XML&availableDBs=defaultdb&sortKeys=Submit+query","http://sru.swissbib.ch/sru/search/defaultdb?query=+dc.anywhere+exact+NATIONALLICENCEoxford101016S0035920399903267&operation=searchRetrieve&recordSchema=info%3Asru%2Fschema%2Fjson&maximumRecords=10&startRecord=0&recordPacking=XML&availableDBs=defaultdb&sortKeys=Submit+query","It was possible to publish this article open access thanks to a Swiss National Licence with the Publisher","Swiss Tropical Institute, Socinstrasse 57, 4002, Basel, Switzerland E-mail: beckhp@ubaclu.unibas.ch",
